"Tech","Date","CVE","Description"
"General","2025-08-17T22:15:25.897","CVE-2025-9093","A security vulnerability has been detected in BuzzFeed App 2024.9 on Android. This affects an unknown part of the file AndroidManifest.xml of the component com.buzzfeed.android. The manipulation leads to improper export of android application components. The attack needs to be approached locally. The exploit has been disclosed to the public and may be used."
"General","2025-08-17T23:15:26.860","CVE-2025-7342","A security issue was discovered in the Kubernetes Image Builder where default credentials are enabled during the image build process. Additionally  virtual machine images built using the Nutanix or the OVA provider do not disable these default credentials  and nodes using the resulting images may be accessible via these default credentials. The credentials can be used to gain root access. Kubernetes clusters are only affected if their Windows nodes use VM images created via the Image Builder project with its Nutanix or OVA provider."
"General","2025-08-17T23:15:27.747","CVE-2025-9094","A vulnerability was detected in ThingsBoard 4.1. This vulnerability affects unknown code of the component Add Gateway Handler. The manipulation leads to improper neutralization of special elements used in a template engine. The attack can be initiated remotely. The exploit has been disclosed to the public and may be used. The vendor replies  that '[t]he fix will come within upcoming release (v4.2) and will be inherited by maintenance releases of LTS versions (starting 4.0).'"
"General","2025-08-17T23:15:28.010","CVE-2025-9095","A flaw has been found in ExpressGateway express-gateway up to 1.16.10. This issue affects some unknown processing in the library lib/rest/routes/users.js of the component REST Endpoint. The manipulation leads to cross site scripting. The attack may be initiated remotely. The exploit has been disclosed to the public and may be used. The vendor was contacted early about this disclosure but did not respond in any way."
"General","2025-08-18T00:15:27.310","CVE-2025-9096","A vulnerability has been found in ExpressGateway express-gateway up to 1.16.10. Affected is an unknown function in the library lib/rest/routes/apps.js of the component REST Endpoint. The manipulation leads to cross site scripting. It is possible to launch the attack remotely. The exploit has been disclosed to the public and may be used. The vendor was contacted early about this disclosure but did not respond in any way."
"General","2025-08-18T00:15:28.280","CVE-2025-9097","A vulnerability was found in Euro Information CIC banque et compte en ligne App 12.56.0 on Android. Affected by this vulnerability is an unknown functionality of the file AndroidManifest.xml of the component com.cic_prod.bad. The manipulation leads to improper export of android application components. It is possible to launch the attack on the local host. The exploit has been disclosed to the public and may be used. The vendor was contacted early about this disclosure but did not respond in any way."
"General","2025-08-18T01:15:29.227","CVE-2025-31713","In engineer mode service  there is a possible command injection due to improper input validation. This could lead to local escalation of privilege with no additional execution privileges needed."
"General","2025-08-18T01:15:30.310","CVE-2025-31714","In Developer Tools  there is a possible missing verification incorrect input. This could lead to local escalation of privilege with no additional execution privileges needed."
"General","2025-08-18T01:15:30.463","CVE-2025-31715","In vowifi service  there is a possible command injection due to improper input validation. This could lead to remote escalation of privilege with no additional execution privileges needed."
"General","2025-08-18T01:15:30.630","CVE-2025-9098","A vulnerability was determined in Elseplus File Recovery App 4.4.21 on Android. Affected by this issue is some unknown functionality of the file AndroidManifest.xml. The manipulation leads to improper export of android application components. The attack needs to be approached locally. The exploit has been disclosed to the public and may be used. The vendor was contacted early about this disclosure but did not respond in any way."
"General","2025-08-18T01:15:30.880","CVE-2025-9099","A vulnerability was identified in Acrel Environmental Monitoring Cloud Platform up to 20250804. This affects an unknown part of the file /NewsManage/UploadNewsImg. The manipulation of the argument File leads to unrestricted upload. It is possible to initiate the attack remotely. The exploit has been disclosed to the public and may be used. The vendor was contacted early about this disclosure but did not respond in any way."
"General","2025-08-18T02:15:27.770","CVE-2025-9100","A security flaw has been discovered in zhenfeng13 My-Blog 1.0.0. This vulnerability affects unknown code of the file /blog/comment of the component Frontend Blog Article Comment Handler. The manipulation leads to authentication bypass by capture-replay. The attack can be initiated remotely. The exploit has been disclosed to the public and may be used."
"General","2025-08-18T03:15:28.420","CVE-2025-9101","A weakness has been identified in zhenfeng13 My-Blog up to 1.0.0. This issue affects some unknown processing of the file /admin/tags/save of the component Tag Handler. The manipulation leads to cross site scripting. The attack may be initiated remotely. The exploit has been disclosed to the public and may be used."
"General","2025-08-18T03:15:28.670","CVE-2025-9102","A security vulnerability has been detected in 1&1 Mail & Media mail.com App 8.8.0 on Android. Affected is an unknown function of the file AndroidManifest.xml of the component com.mail.mobile.android.mail. The manipulation leads to improper export of android application components. It is possible to launch the attack on the local host. The exploit has been disclosed to the public and may be used. The vendor was contacted early about this disclosure but did not respond in any way."
"General","2025-08-18T04:15:39.453","CVE-2025-9103","A vulnerability was detected in ZenCart 2.1.0. Affected by this vulnerability is an unknown functionality of the component CKEditor. The manipulation leads to cross site scripting. The attack can be launched remotely. The exploit has been disclosed to the public and may be used. The real existence of this vulnerability is still doubted at the moment. The vendor declares this as 'intended behavior  allowed for authorized administrators'."
"General","2025-08-18T04:15:43.123","CVE-2025-9104","A flaw has been found in Portabilis i-Diario up to 1.5.0. The affected element is an unknown function of the file /planos-de-aulas-por-disciplina/ of the component Informações Adicionais Page. This manipulation of the argument Parecer/Objeto de Conhecimento/Habilidades causes cross site scripting. Remote exploitation of the attack is possible. The exploit has been published and may be used. The vendor was contacted early about this disclosure but did not respond in any way."
"General","2025-08-18T04:15:46.850","CVE-2025-9105","A vulnerability has been found in Portabilis i-Diario up to 1.5.0. The impacted element is an unknown function of the file /planos-de-ensino-por-areas-de-conhecimento/ of the component Informações Adicionais Page. Such manipulation of the argument Parecer/Conteúdos/Objetivos leads to cross site scripting. The attack can be executed remotely. The exploit has been disclosed to the public and may be used. The vendor was contacted early about this disclosure but did not respond in any way."
"General","2025-08-18T05:15:28.730","CVE-2025-9106","A vulnerability was found in Portabilis i-Diario up to 1.5.0. This affects an unknown function of the file /planos-de-ensino-por-disciplina/ of the component Informações Adicionais Page. Performing manipulation of the argument Parecer/Conteúdos/Objetivos results in cross site scripting. The attack is possible to be carried out remotely. The exploit has been made public and could be used. The vendor was contacted early about this disclosure but did not respond in any way."
"General","2025-08-18T05:15:29.780","CVE-2025-9107","A vulnerability was determined in Portabilis i-Diario up to 1.5.0. This impacts an unknown function of the file /alunos/search_autocomplete. Executing manipulation of the argument q can lead to cross site scripting. The attack may be performed from a remote location. The exploit has been publicly disclosed and may be utilized. The vendor was contacted early about this disclosure but did not respond in any way."
"General","2025-08-18T06:15:29.907","CVE-2025-9108","Affected is an unknown function of the component Login Page. The manipulation leads to improper restriction of rendered ui layers. It is possible to launch the attack remotely."
"General","2025-08-18T06:15:30.250","CVE-2025-9109","A security flaw has been discovered in Portabilis i-Diario up to 1.5.0. Affected by this vulnerability is an unknown functionality of the file /password/email of the component Password Recovery Endpoint. The manipulation results in observable response discrepancy. It is possible to launch the attack remotely. This attack is characterized by high complexity. The exploitation appears to be difficult. The exploit has been released to the public and may be exploited."
"General","2025-08-18T07:15:28.227","CVE-2025-57700","DIAEnergie - Stored Cross-site Scripting"
"General","2025-08-18T07:15:29.217","CVE-2025-57701","DIAEnergie - Reflected Cross-site Scripting"
"General","2025-08-18T07:15:29.447","CVE-2025-57702","DIAEnergie - Reflected Cross-site Scripting"
"General","2025-08-18T07:15:29.607","CVE-2025-57703","DIAEnergie - Reflected Cross-site Scripting"
"General","2025-08-18T07:15:29.763","CVE-2025-6625","CWE-20: Improper Input Validation vulnerability exists that could cause a Denial Of Service when specific crafted FTP command is sent to the device."
"General","2025-08-18T08:15:27.820","CVE-2025-5296","CWE-59: Improper Link Resolution Before File Access ('Link Following') vulnerability exists that could cause  arbitrary data to be written to protected locations  potentially leading to escalation of privilege  arbitrary file  corruption  exposure of application and system information or persistent denial of service when a low-privileged  attacker tampers with the installation folder."
"General","2025-08-18T09:15:28.637","CVE-2025-41242","Spring Framework MVC applications can be vulnerable to a “Path Traversal Vulnerability” when deployed on a non-compliant Servlet container.  An application can be vulnerable when all the following are true:    *  the application is deployed as a WAR or with an embedded Servlet container   *  the Servlet container  does not reject suspicious sequences https://jakarta.ee/specifications/servlet/6.1/jakarta-servlet-spec-6.1.html#uri-path-canonicalization    *  the application  serves static resources https://docs.spring.io/spring-framework/reference/web/webmvc/mvc-config/static-resources.html#page-title  with Spring resource handling   We have verified that applications deployed on Apache Tomcat or Eclipse Jetty are not vulnerable  as long as default security features are not disabled in the configuration. Because we cannot check exploits against all Servlet containers and configuration variants  we strongly recommend upgrading your application."
"General","2025-08-18T09:15:28.840","CVE-2025-47206","An out-of-bounds write vulnerability has been reported to affect File Station 5. If a remote attacker gains a user account  they can then exploit the vulnerability to modify or corrupt memory.  We have already fixed the vulnerability in the following version: File Station 5 5.5.6.4933 and later"
